Product,Quantity,Retail Price,Total Retail Price,UPC,Notes,purl,bid
Fujinon XF60mmF2.4 R Macro,1,$649.00 ,$649.00 ,,,https://www.liquidation.com/auction/view?id=14473633,150
Mighty Mule Replacement Control Board for Mighty Mule Gate Openers (R4211),1,$248.37 ,$248.37 ,,,,
"1080P HD Projector, WiFi Projector Bluetooth Projector, Fangor 5500 Lumen 230"" Portable Movie Projector, Compatible with TV Stick, HDMI, VGA, USB, Laptop, iPhone Android for PowerPoint Presentation",1,$139.17 ,$139.17 ,,,,
"Polaroid Originals OneStep 2 VF Instant Film Cameras, Mint (9007)",1,$79.96 ,$79.96 ,,,,
Pokémon Shield - Nintendo Switch,1,$59.99 ,$59.99 ,,,,
"Epson T127120-D2 DURABrite Ultra Black Dual Pack Extra High Capacity Cartridge Ink,Black Multipack",1,$59.95 ,$59.95 ,,,,
OtterBox DEFENDER SERIES SCREENLESS EDITION Case for Galaxy S20+/Galaxy S20+ 5G - GONE FISHIN (WET WEATHER/MAJOLICA BLUE),1,$59.95 ,$59.95 ,,,,
Assorted Office and Electronics,1,$39.99 ,$39.99 ,,,,
Assorted Office and Electronics,1,$39.99 ,$39.99 ,,,,
Assorted Office and Electronics,1,$39.99 ,$39.99 ,,,,
Assorted Office and Electronics,1,$39.99 ,$39.99 ,,,,
Assorted Office and Electronics,1,$39.99 ,$39.99 ,,,,
Harmon 5205 J1 Triple Play Trumpet Mute,1,$39.99 ,$39.99 ,,,,
Assorted Office and Electronics,1,$39.99 ,$39.99 ,,,,
Assorted Office and Electronics,1,$39.99 ,$39.99 ,,,,
Assorted Office and Electronics,1,$39.99 ,$39.99 ,,,,
Assorted Office and Electronics,1,$39.99 ,$39.99 ,,,,
Assorted Office and Electronics,1,$39.99 ,$39.99 ,,,,
Assorted Office and Electronics,1,$39.99 ,$39.99 ,,,,
Assorted Office and Electronics,1,$39.99 ,$39.99 ,,,,
Assorted Office and Electronics,1,$39.99 ,$39.99 ,,,,
Assorted Office and Electronics,1,$39.99 ,$39.99 ,,,,
Assorted Office and Electronics,1,$39.99 ,$39.99 ,,,,
Assorted Office and Electronics,1,$39.99 ,$39.99 ,,,,
Assorted Office and Electronics,1,$39.99 ,$39.99 ,,,,
Assorted Office and Electronics,1,$39.99 ,$39.99 ,,,,
Assorted Office and Electronics,1,$39.99 ,$39.99 ,,,,
Pokémon Sword and Pokémon Shield Double Pack - Nintendo Switch,1,$39.86 ,$39.86 ,,,,
"8-Sheet Strip-Cut Paper, CD and Credit Card Home Office Shredder",1,$38.49 ,$38.49 ,,,,
Apple Smart Cover (for iPad 9.7-inch) - Charcoal Gray,1,$30.99 ,$30.99 ,,,,
"ONHI Wireless Keyboard Case for iPad 10.2 7th Generation 2019, iPad Air 3 10.5""(3rd Gen) and iPad Pro10.5"" 2017,360 Rotatable-7 Colors Back-lit, Smart Folio Back Wireless Keyboard Case(Rose Gold)",1,$26.21 ,$26.21 ,,,,
"Microphone Arm Stand, TONOR Adjustable Suspension Boom Scissor Mic Stand with Pop Filter, 3/8"" to 5/8"" Adapter, Mic Clip, Upgraded Heavy Duty Clamp for Blue Yeti Nano Snowball Ice and Other Mics(T20)",1,$24.32 ,$24.32 ,,,,
Ventilated Adjustable Laptop Computer Holder Desk Stand,1,$23.04 ,$23.04 ,,,,
"Wireless Earbuds, BLZK Latest Bluetooth 5.0 True Wireless Bluetooth Earbuds, with bass 3D Stereo Sound Wireless Headphones, Built-in Microphone LED Digital Shows Charging Charge (Black)",1,$23.03 ,$23.03 ,,,,
"PETG 3D Printer Filament, 2.85mm, White, 1 kg Spool",1,$21.99 ,$21.99 ,,,,
"i-Blason Cosmo Full-Body Case for iPhone Xs/ iPhone X Case 2018 Release, Blue, 5.8""",1,$21.99 ,$21.99 ,,,,
"i-Blason Cosmo Series Case for iPhone 11 Pro 5.8 inch, Slim Full-Body Stylish Protective Case with Built-in Screen Protector (Marble)",1,$19.99 ,$19.99 ,,,,
Super Mario Party,1,$19.93 ,$19.93 ,,,,
DualShock 4 Wireless Controller for PlayStation 4 - Blue Camouflage,1,$17.44 ,$17.44 ,,,,
2014 Forest Hills Drive,1,$17.40 ,$17.40 ,,,,
"Outdoor WiFi Security Camera, 1080P Wi-Fi IP Camera Two Way Audio Motion Detection Remote Viewing FTP Onvif Night Vision IP66 Waterproof Bullet Surveillance CCTV Cam Support Max 128G SD Card(NO Card)",1,$16.70 ,$16.70 ,,,,
"Fujifilm Instax Mini Instant Film, 10 Sheets×5 Pack(Total 50 Shoots)",1,$15.53 ,$15.53 ,,,,
"iPad 9.7-inch (iPad 6, 2018 / iPad 5, 2017) Keyboard, Arteck Ultra-Thin Bluetooth Keyboard with Folio Full Protection Case for Apple iPad 9.7 iPad 6, 5 and iPad Air 1 with 130 Degree Swivel Rotating",1,$15.03 ,$15.03 ,,,,
Spigen Liquid Air Armor Designed for Apple iPhone 11 Pro Case (2019) - Matte Black,1,$14.85 ,$14.85 ,,,,
"D'Addario EXL120-3D Nickel Wound Electric Guitar Strings, Super Light, 9-42, 3 Sets",1,$13.99 ,$13.99 ,,,,
OtterBox Commuter Series Case for Samsung Galaxy J3 (2016)/J3 V - Frustration Free Packaging - Black,1,$13.63 ,$13.63 ,,,,
Blue Train,1,$13.39 ,$13.39 ,,,,
Wireless Computer Mouse with Nano Receiver,1,$12.99 ,$12.99 ,,,,
42.5-Inch Length ABBREE SMA-Female Dual Band 144/430Mhz Foldable CS Tactical Antenna for Baofeng UV-5R UV-82 BF-F8HP Ham Two Way Radio,1,$11.87 ,$11.87 ,,,,
"GE Backlit Universal Remote Control for Samsung, Vizio, Lg, Sony, Sharp, Roku, Apple TV, Smart TVs, Streaming Players, Blu-Ray, DVD, Master Volume Control, 6-Device, Silver, 37038",1,$10.89 ,$10.89 ,,,,
"LAX iPhone Charger Lightning Cable - MFi Certified Durable Braided Apple Lightning USB Cord for iPhone 11/11 Pro Max/XS Max/X/iPad, iPod & More",1,$10.52 ,$10.52 ,,,,
"USB C to DisplayPort Cable (4K60Hz, 2K144Hz) WARRKY 6.6ft Certified [24K Gold-Plated, Slim Aluminum Shell] WFH Must Thunderbolt 3 to DP Cable for MacBook Pro/Air, iPad Pro, Galaxy S10/S9/S8, More",1,$10.03 ,$10.03 ,,,,
"iPhone to HDMI Digital AV Adapter, Lighting to HDMI Adapter, 2 in 1 Plug and Play 1080P HDTV Connector Compatible with iPhone iPad iPod Models on TV/Monitor/Projector",1,$9.38 ,$9.38 ,,,,
"GREENCYCLE Re-Manufactured PG-240XL 240 XL Ink Cartridge Compatible for Canon PIXMA MG3620 MG4220 MG3220 MG2220 MX392 MX432 MX472 MX512 MG3522 MX522 MX532 Printer (Black, 1 Pack)",1,$9.15 ,$9.15 ,,,,
"USB Type-C to USB-A 2.0 Male Charger Cable, 3 Feet (0.9 Meters), White",1,$7.47 ,$7.47 ,,,,
VIVO Universal Adjustable 10 to 15.6 inch Laptop Mount Holder for VESA Compatible Monitor Arms Notebook Tray (Stand-LAP3),1,$6.58 ,$6.58 ,,,,
"USB Type C Charger Cable 6.6FT 2-Pack,Nylon Charging Power Cord for New Fire HD 10 (2019) HD 8 (2020),Samsung Galaxy Fold A10E A20 A20E A30 A40 A51 A8 A9,S20 Plus Ultra,LG V50 V40 G8 Thinq,Moto Z3 G7",1,$6.36 ,$6.36 ,,,,
"LASMEX 2.5mm to 3.5mm Aux Cable with Mic & Remote Compatible with Bose 700 / QuietComfort QC35ii / QC35 / QC25 Noise Cancelling Headphones, Audio Replacement Cord Wire for Androids, PS4, Xbox",1,$5.57 ,$5.57 ,,,,
"Fujifilm INSTAX Mini Instant Film 2 Pack = 20 Sheets (White) for Fujifilm Mini 8 & Mini 9 Cameras, Model:4332059078",1,$5.34 ,$5.34 ,,,,
USB-Powered PC Computer Speakers with Dynamic Sound Silver,1,$4.62 ,$4.62 ,,,,
Maped Technic Expert Vinyl Eraser x2 (105849),1,$1.99 ,$1.99 ,,,,
Wiresmith AC Power Adapter Charger for Nintendo Gameboy Advance GBA Micro,1,$1.76 ,$1.76 ,,,,
SimYoung Thunderbolt Mini Display Port to HDMI Cable for Apple iMac MacBook Air Pro 6FT Black,1,$1.59 ,$1.59 ,,,,
